<?xml version="1.0" encoding="UTF-8"?>
<personas  xmlns:xsi="http://www.w3.org/2001/XMLSchema-instance" xsi:noNamespaceSchemaLocation="UD4_T2B_tarefaB_yagootero.xsd">
  <persona>
    <nombre>Pepa</nombre>  
    <apellido>Galan</apellido>
    <fechanacimiento>2024-12-31</fechanacimiento>
    <numerodocumento>123456</numerodocumento>
    <trianero>true</trianero>
  </persona>
  <persona>
    <nombre>Pepa</nombre>  
    <apellido>Galan</apellido>
    <fechanacimiento>2024-12-31</fechanacimiento>
    <numerodocumento>123456</numerodocumento>
    <trianero>true</trianero>
  </persona>
</personas>
